<?xml version="1.0" encoding="UTF-8"?>
<!DOCTYPE book SYSTEM "sefaria.dtd">
<book id="Tractate-hakdama4">
<front/><body><chapter num="1">
<label>הקדמה למסכת גרים </label>
<p> מצאתי בספר שמחת הרגל נדפס בליוורני . אשר חבר מהור׳׳ר חיים יוסף דוד אזולאי מיקירי
אנשי ירושלים עה״ק תוב״ב ובסוף ספרו נדפס מסכת גרים הביאה הרב בעל מגדל עוז כמה פעמים בפי״ג
מהלכות אסורי ביאה להרמב״ם ז״ל . אכן לא ידע אנוש ערכה . והיא עלומה . והמחבר ספר הנ"ל הוציאה לאורה
וכתב בוה הלשון . מס׳ זו מהמסכת קטנות והיא לא נדפס״ה והועתקה מהש״ס המצויה בעיר פפערשא כתוב
על קלף בעיר פאריץ בשנת ק״ג לאלף הששי לאחד מקרובי רבינו שמשון משאנץ . והזכרתי ש״ס זה בספרי
הקטן שער יוסף . גם הוזכר בספר קרבן נתנאל בדף האחרון עכ״ל ספר הנ״ל אכן מס׳ זו הציגוה ערומה
. כיום הולדה . מבלי פירוש לדבריה . כדרך כל ריעותיה . שאר מס' קטנות נעו מעגלותיה . על כן נתתי אל
לבי דברי חז״ל המתחיל במצוה אומרים לו גמור . וכאשר פרשתי בעז״ה כל המסכת קטנות בפירוש קל ונכון
ככה עשיתי למס׳ הזאת לבארה באר היטב ע"פ ש״ס ופוסקים כיד ה׳ הטובה עלי והראיתי בה מבוא כל הלכה
איה מקום כבודה בש״ס למען ירוץ הקורא בה : </p>


<p>גם אלה דברי המחבר ספר נחלת יעקב הקטן המכונה יאקאב ב׳׳ה ברוך נוימבורג ז״ל מתושבי ק׳׳ק אופיבאך
בשנת און וחקר ותק"ן לפ״ק : <pgbrk id="119B"/> </p></chapter>
</body>
<back/></book>